{
  "_schema": "ruptura.vtt.master_tables.v1.0",
  "_meta": {
    "conteudo": "tabelas_mestre",
    "fonte": "Derivado do manifesto rupture_core_manifest_v0_1.json e dos DBs core v0.1",
    "versao_schema": "1.0.0",
    "status_padrao": "published",
    "gerado_em": "2026-06-29",
    "total_master_tables": 50,
    "total_content_tables": 11,
    "hash_manifest": "e353942d4c4d00abdeaf126f075f5775e58c2e83c5586c73d6d40115fb330a61",
    "hashes_por_db": {
      "regras_personagem": "4d857f34954bb3169abfb4af27a4fa42dc22ad1b4dc2c05282ae9a04851c4188",
      "campo_combate": "dc06d963c4c44e225e3242211b2d915eb222951c684c36581db11c42bf49b9ce",
      "fluxo_combate": "795d8be36b40eb391ff450aa52e2858392ed952b97594687630d7fe6974b745c",
      "acoes_combate": "36605aa197a975ffc807757e9a845dd985bacdb43a12f08a201372c17503b8dd",
      "condicoes": "019128c9f0b4edcd6ea26c1c67dcdcc71ec10b51be9ce83e231af3b61a3b072e",
      "propriedades": "d140efd86cad3fc50115f26c9f5164fe3e335902061148c09713a0e8f009b91f",
      "equipamentos": "cf03d594413e1fa90fc5e4207de66e2c44c9e5a179a8fe609bc0e9b0127e6aac",
      "runas": "ab760e4356e015a589a7f2083c7c76487a1d1f07a1694c2bc31704c927a5bc9e",
      "escalpos": "53c120cc03233ea4b020a6ff42888ce3028dc019d2bb0235d783398676af8611",
      "talentos": "8aefe863bd340fab76ffec601573a6e9fa743268d5cf3c88d7517d64fcf3e64c",
      "magias": "1facd49f9d7f937da70742b5e30be256bb551375b04951bf20bf80ed06184a17"
    },
    "hash_conjunto_fontes": "b4658e19b04ccfffe2239c01c2578dfdd3d28d21876b33ccce3bcf29c2d2e756",
    "observacoes": [
      "Contrato importável para validação cruzada e geração de enums no frontend.",
      "As tabelas M* representam vocabulários canônicos; as tabelas C* representam coleções de conteúdo/importação.",
      "Quando um enum aparece em mais de um DB, a fonte autoritativa fica registrada em source.",
      "Tags de sistema e cadências usam união controlada porque vários bancos contribuem com vocabulário."
    ]
  },
  "policy": {
    "id_binding": "snake_case_ascii",
    "master_table_ids_are_stable": true,
    "content_table_ids_are_stable": true,
    "unknown_value_policy": "error",
    "tag_union_policy": "permitir_apenas_valores_presentes_em_M10_ou_M11_conforme_contexto",
    "action_reference_policy": "acoes_sao_referenciadas_por_M5; nunca como pericia",
    "damage_policy": "tipo_dano usa M6; subtipo_dano usa M7",
    "schema_validation": "obrigatoria",
    "cross_validation": "obrigatoria"
  },
  "master_tables": [
    {
      "id": "M1",
      "name": "Atributos",
      "category": "personagem",
      "kind": "enum",
      "validation": "closed",
      "source": {
        "db": "regras_personagem",
        "path": "enums.atributos",
        "file": "db_regras_personagem_normalizado_v1_4.json",
        "_schema": "ruptura.vtt.core.regras_personagem.v1.4"
      },
      "count": 3,
      "values": [
        "corpo",
        "mente",
        "animo"
      ],
      "description": "Atributos base usados em rolagem, derivados e requisitos.",
      "status": "published",
      "version": "1.0.0",
      "created_at": "2026-06-29",
      "updated_at": "2026-06-29"
    },
    {
      "id": "M2",
      "name": "Perícias",
      "category": "personagem",
      "kind": "enum",
      "validation": "closed",
      "source": {
        "db": "regras_personagem",
        "path": "enums.pericias",
        "file": "db_regras_personagem_normalizado_v1_4.json",
        "_schema": "ruptura.vtt.core.regras_personagem.v1.4"
      },
      "count": 21,
      "values": [
        "arcanismo",
        "artes",
        "balistica",
        "biologia",
        "carisma",
        "engenharia",
        "furtividade",
        "influencia",
        "intimidacao",
        "logica",
        "luta",
        "mobilidade",
        "percepcao",
        "precisao",
        "psicologia",
        "reflexos",
        "robotica",
        "sociedade",
        "tecnomagia",
        "vigor",
        "vontade"
      ],
      "description": "Perícias canônicas da ficha.",
      "status": "published",
      "version": "1.0.0",
      "created_at": "2026-06-29",
      "updated_at": "2026-06-29"
    },
    {
      "id": "M3",
      "name": "Recursos",
      "category": "personagem",
      "kind": "enum",
      "validation": "closed",
      "source": {
        "db": "regras_personagem",
        "path": "enums.recursos",
        "file": "db_regras_personagem_normalizado_v1_4.json",
        "_schema": "ruptura.vtt.core.regras_personagem.v1.4"
      },
      "count": 8,
      "values": [
        "pv",
        "pe",
        "mana",
        "integridade",
        "pv_temporario",
        "mana_temporaria",
        "pa",
        "sobrecarga"
      ],
      "description": "Recursos controlados na ficha.",
      "status": "published",
      "version": "1.0.0",
      "created_at": "2026-06-29",
      "updated_at": "2026-06-29"
    },
    {
      "id": "M4",
      "name": "Condições",
      "category": "efeitos",
      "kind": "enum",
      "validation": "closed",
      "source": {
        "db": "condicoes",
        "path": "condicoes[].id",
        "file": "db_condicoes_normalizado_v1_5.json",
        "_schema": "ruptura.vtt.content.condicoes.v1.5"
      },
      "count": 17,
      "values": [
        "agarrado",
        "agarrando",
        "atordoado",
        "caido",
        "cego",
        "contundido",
        "envenenado",
        "imobilizado",
        "insaturado",
        "inconsciente",
        "lento",
        "ofuscado",
        "queimando",
        "sufocando",
        "sangrando",
        "saturado",
        "surdo"
      ],
      "description": "Condições canônicas aplicáveis a personagens e efeitos.",
      "status": "published",
      "version": "1.0.0",
      "created_at": "2026-06-29",
      "updated_at": "2026-06-29"
    },
    {
      "id": "M5",
      "name": "Ações de combate",
      "category": "combate",
      "kind": "enum",
      "validation": "closed",
      "source": {
        "db": "acoes_combate",
        "path": "acoes[].id",
        "file": "db_acoes_combate_normalizado_v1_1.json",
        "_schema": "ruptura.vtt.content.acoes_combate.v1.1"
      },
      "count": 28,
      "values": [
        "deslocar",
        "levantar",
        "escapar",
        "fintar",
        "interagir",
        "sacar_rapido",
        "sacar_dificil",
        "recarregar",
        "postura_ofensiva",
        "postura_defensiva",
        "atacar",
        "agarrar",
        "estrangular",
        "derrubar",
        "empurrar",
        "desarmar",
        "aparar",
        "bloquear",
        "esquivar",
        "resistir",
        "mirar",
        "acessar_trama",
        "preparar_turno",
        "usar_pericia",
        "falar",
        "gestos_rapidos",
        "soltar_alvo",
        "apagar_fogo"
      ],
      "description": "Ações canônicas do console de combate.",
      "status": "published",
      "version": "1.0.0",
      "created_at": "2026-06-29",
      "updated_at": "2026-06-29"
    },
    {
      "id": "M6",
      "name": "Tipos de dano",
      "category": "dano",
      "kind": "enum",
      "validation": "closed",
      "source": {
        "db": "regras_personagem",
        "path": "enums.tipos_dano",
        "file": "db_regras_personagem_normalizado_v1_4.json",
        "_schema": "ruptura.vtt.core.regras_personagem.v1.4"
      },
      "count": 6,
      "values": [
        "fisico",
        "energetico",
        "acido",
        "toxico",
        "psiquico",
        "trauma"
      ],
      "description": "Tipos principais de dano.",
      "status": "published",
      "version": "1.0.0",
      "created_at": "2026-06-29",
      "updated_at": "2026-06-29"
    },
    {
      "id": "M7",
      "name": "Subtipos de dano",
      "category": "dano",
      "kind": "enum",
      "validation": "closed",
      "source": {
        "db": "equipamentos",
        "path": "enums.subtipo_dano",
        "file": "db_equipamentos_normalizado_v1_2.json",
        "_schema": "ruptura.vtt.content.equipamentos.v1.2"
      },
      "count": 10,
      "values": [
        "cortante",
        "contundente",
        "perfurante",
        "igneo",
        "gelido",
        "eletrico",
        "acido",
        "toxico",
        "psiquico",
        "trauma"
      ],
      "description": "Subtipos de dano usados por armas, magias, runas e efeitos.",
      "status": "published",
      "version": "1.0.0",
      "created_at": "2026-06-29",
      "updated_at": "2026-06-29"
    },
    {
      "id": "M8",
      "name": "Raridades",
      "category": "conteudo",
      "kind": "enum",
      "validation": "closed",
      "source": {
        "db": "equipamentos",
        "path": "enums.raridade",
        "file": "db_equipamentos_normalizado_v1_2.json",
        "_schema": "ruptura.vtt.content.equipamentos.v1.2"
      },
      "count": 5,
      "values": [
        "comum",
        "incomum",
        "muito_comum",
        "muito_raro",
        "raro"
      ],
      "description": "Raridades canônicas para conteúdo de loja e biblioteca.",
      "status": "published",
      "version": "1.0.0",
      "created_at": "2026-06-29",
      "updated_at": "2026-06-29"
    },
    {
      "id": "M9",
      "name": "Cadências",
      "category": "automacao",
      "kind": "enum",
      "validation": "union",
      "source": {
        "db": "talentos",
        "path": "enums.cadencia",
        "file": "db_talentos_normalizado_v1_3.json",
        "_schema": "ruptura.vtt.content.talentos.v1.3"
      },
      "count": 10,
      "values": [
        "cena",
        "combate",
        "descanso_longo",
        "dia",
        "enquanto_na_area",
        "missao",
        "permanente",
        "rodada",
        "sessao",
        "sessao_malha"
      ],
      "description": "Cadências de uso, recuperação e gatilho recorrente.",
      "status": "published",
      "version": "1.0.0",
      "created_at": "2026-06-29",
      "updated_at": "2026-06-29"
    },
    {
      "id": "M10",